<?xml version="1.0" encoding="UTF-8"?>
<!--
To change this license header, choose License Headers in Project Properties.
To change this template file, choose Tools | Templates
and open the template in the editor.
-->

<!DOCTYPE internet SYSTEM '03.dtd'>

<internet>
    <hechoHistorico>
        <descripcion>Se Funda Youtube</descripcion>
        <fecha>
            
            <dia>15</dia>
            <mes>02</mes>
            <anyo>2005</anyo>
        </fecha>
    </hechoHistorico>
    <hechoHistorico>
		<descripcion>Se funda Google</descripcion>
		<fecha>
			<dia>04</dia>
			<mes>09</mes>
			<anyo>1998</anyo>
		</fecha>
	</hechoHistorico>
	<hechoHistorico>
		<descripcion> Se Funda Facebook</descripcion>
		<fecha>
			<dia>04</dia>
			<mes>02</mes>
			<anyo>2004</anyo>
		</fecha>
	</hechoHistorico>
</internet>
